label	text
1	在過去的 6 年裡，我一直在台灣泡溫泉、公共浴池和游泳池。我熟悉台灣的沐浴文化。這是我第一次因為我的泳衣是“錯誤的材料”而被拒之門外。
0	我想我應該先閱讀評論。我有一個潛在的懷疑，這種隱藏的外國人稅是對前台女士的 300 nt 喧囂，也是降低入場費的一種方式。
0	不進去，在上面看看就出來了。
1	我 10 年前去了，帶著美好的回憶回去了，但它真的很糟糕。
0	淋浴設施關閉，人們彼此之間不友好。
0	一個3歲的孩子在水里泡了一會兒就得了蕁麻疹，還抱怨疼...
0	門票很便宜，所以我帶了泳衣和毛巾，但他們拒絕了。如果不是您想要的泳衣類型，則必須租用。這完全是個笑話。
0	沒有推薦！門口的小姐姐只賣泳衣，說我們的泳衣不適合泡溫泉，不過差不多。絕對扯掉，如果可能的話，我們會給零星。
1	可怕的地方，我和父親想去洗澡。然而，當我穿著完美的泳衣進入時。他們告訴我們，我不能穿它們，必須買一雙新的。
0	哦，由於我父親無可辯駁的邏輯，我們得到了退款。基本上他們給了我們錢所以我們最終會離開😂無恥的地方
0	雖然這個地方快速暢遊並不昂貴，但前門的人很粗魯和咄咄逼人。他們對客戶服務一無所知，這體現在他們的態度上。他們不會營銷他們的水療中心，而是會侮辱潛在客戶。我今天在那裡，當我問我是否可以在付款前看一看內部時，他們（一個女人和一個男人）都允許我們看一看，但會一直說“最好決定，要么付錢，要么離開”。他們破壞了在那裡洗澡的任何興趣。我寧願去他們歡迎我們業務的其他地方。
0	水質差、年齡段高還好，但令人惱火的是，有商販試圖以高價出售廉價泳衣。
0	中國溫泉不要去。不要想著日本溫泉。雖然是露天的，但是水太髒了。如果你沒有泳衣口袋也不帶新的，他們會賣給你一件泳衣。 60台幣的便宜是有原因的。無論如何，我強烈建議不要去這裡。
0	在這裡的體驗非常糟糕。我在去這里之前已經閱讀了提示，如果不想買他們的褲子，我們需要帶上我們的褲子。按照建議，我自己帶了，但是當我拿著票進去的時候，他們讓我出示我的褲子，他們說我穿錯了。我很確定我的和他們的是同一類型的。這與錢無關，但我不喜歡被騙。有傳言說。
0	如果你還想嘗試，你必須付錢，我們不需要付錢。
0	我相信他們需要泳衣來以昂貴的價格出售他們醜陋的泳衣。不，謝謝。
0	一點都不喜歡。首先，門口的女士似乎很不友好。仍然支付了入場費 - 因為我在那裡我畢竟想進去！雖然最後沒有進入游泳池：沒有更換的空間，一切看起來又舊又髒，他們向您收取儲物櫃、淋浴、吹風機的費用。
0	我被罵了一種把熱水倒在腳上的方法。腳上全是泥巴，沒地方穿襪子（基本款涼鞋就好）。有很多當地人，他們在監視方面投入了很多精力。我知道這很愛管閒事，但當地人很吵。我意識到日本的溫泉是最好的。
0	帶上你的 Speedo 或 Banana Hammock - 如果你是白人或其他外國人，不允許穿著任何有口袋的泳衣（台灣或中國的都可以）。粗魯的員工，不干淨，糟糕的經歷。 15分鐘後出發，到北投也需要一段時間。
1	在台灣最好嘗試一下比這更好的其他溫泉。
0	不是穿著泳衣去的地方，下面有一個叫emperor myeongtang的室內私人浴池或者公共浴池，那就好多了。
0	騙子...做好準備
0	我對泳褲不合適很生氣，所以我穿了更長的泳褲 - 有人告訴我不允許
0	你必須在門口支付 250 TN 才能買到便宜的短褲，否則你無法進入 - 我沒有
0	為售票機找回正確的 TN$40 或不找零:)
0	用愚蠢的技巧...
0	兩個月前，說要租泳衣，就決定租，但是因為是年初，客人多，租不到，叫我去買...
0	旁邊的歐洲人也在打架，男的想買泳衣，女的卻生氣了……
1	我們也轉身
0	不友好的工作人員。作為一個男人，你必須購買特殊的泳裝，因為你自己的泳裝會用錯材料。女士們可以穿自己喜歡的衣服。再也不 ！！！
0	令人難以置信的粗魯的工作人員。換好衣服後，我錯誤地穿了太長的泳褲，櫃檯小姐開始對我大喊大叫。當我禮貌地試圖解釋它們是游泳短褲時，她開始大聲喊叫——就像一隻失控的狂吠的狗。這給附近的其他人造成了尷尬和不必要的場面。
0	入口處的女士說我穿著完全正常的泳褲不讓進，最終只是因為她想賣掉她的緊身褲。荒謬的！
1	我很高興去那裡但是
0	它又小又髒
1	最好帶私人浴室的好汽車旅館。
0	被拒絕了，因為我的衝浪短褲是錯誤的材料，在快速爭論之後，她指著我的口袋說我不能穿著衝浪板進入。完全是浪費時間。不要去我警告你的這些溫泉，如果你嘗試，你很可能會被拒之門外！！！
0	之前的印象並不干淨，但儲物櫃周圍的惡臭超出了我的忍耐極限。
0	除非有一些改善，否則我不想去。
0	便宜但是質量很差。每個浴缸裡都擠滿了老年人，你甚至可以聞到他們的味道。除非你喜歡老年人群，否則不推薦這個地方
0	小，不多你不能停下來。
0	上面寫著 40 新台幣入場，但如果你是白人，至少要準備好再花 300 元。
0	工作人員非常粗魯和不屑一顧。我問了一個關於衣服的問題，她開始對我大喊大叫。這裡只允許使用彈性泳衣。
0	不要以外國人的身份去這裡。他們會說，如果你的衣服有口袋或者是棉質的，你就不能游泳。一個老男人會罵你，讓你難堪，強迫你買NT300+的泳衣。
0	浪費一顆星，只有韓國人才會泳衣困擾
0	誠實從來不會出現兩次
0	噁心的水，不合理的泳裝規定，缺乏經驗太貴了。可能會給你細菌感染
0	非常糟糕的客戶服務，他們基本上強迫你買他們的泳衣，非常粗魯的員工。最好多花一點錢，找一個更好的地方
0	就是因為標準不符合。
1	好好看看圖片
1	台北時時刻刻都能感受到的地方
1	大多數當地祖父母使用的地方
1	便宜是有原因的
1	去春城
0	即使穿著普通泳褲也不允許進入。他們似乎正試圖出售他們的商品
0	大敲詐！他們只是想賣給你泳褲。不會推薦！
0	很挑剔，為什麼不穿短褲？沒有意義。和不友好的工作人員。
0	溫泉太誇張了！
0	人太多，更衣室、淋浴等設施不好。
0	員工對待你就好像你欠他們錢一樣。非常粗魯。
0	泡溫泉癢癢就站幾分鐘
1	最好住在一個不錯的酒店...不是這裡
0	真的很髒。。
0	死了也不會回來！！！
0	相當不適合歐洲人
0	不要在這裡浪費你的時間。
0	壞地方和壞人...不推薦
0	我在這裡有不好的經歷
0	水不干淨。。。。
0	非常粗魯的員工。
0	有點臟
0	太擁擠。
0	假日人潮多到爆，違規停車的一堆導致行人機車汽車要爭道各種險象環生，原本的地下停車場可能有外租給別人，車位又更少了
1	好像走進秘密花園，但夜晚行走時較不安全，因現場的路燈照度不足（大樹枝葉擋住），故建議有關單位親身體驗，應重新規劃可以增加市民休閒更安全好去處。
1	它是榮濱商圈唯一大型公園,提供附近居民,上市場採買人員,及上了年紀老人,運動、休閒,集會的好去處。
1	園內花草樹木照顧不差,景緻箅是不錯,公園設施、廁所齊備…。有空,或路過此處,不妨進去走走。
1	和我童年時的榮星花園完全不一樣 童年 花很多很漂亮 現在只有 大樹
0	靠近龍江路一側的草叢有非常多老鼠! 一到傍晚就會開始出沒…
0	停車場出口的長椅長期遭遊民霸佔為家，停管處人員視若無睹
0	籃球場髒的完全沒人清理都是土
1	吸收紛多精，體驗大自然環境，松鼠和鳥與大地共舞
0	流浪人 占領的領域歐……還有一個空攤子， 怎好？
0	小黑蚊 蚊子太多
0	常常有變態在這裡遛狗！噁心～
1	街頭藝人演奏
1	非常適合休閒的公園
1	外籍看護 聚會場!
0	很不怎麼樣
0	沒去
0	沒太大意義
0	沒去過
1	很棒的防災公園
0	好爛喔
1	路過
1	老公園了
1	知性之旅好去處
0	台灣相關單位就是這樣。再好的古蹟都會拿來翻新並改為營利用途。
0	室外拍照也要索價1500元，強烈不建議來此景點。
0	沒開啦還問我怎樣
0	不怎麼樣！
1	我到台北市時 ，記得台北監獄還在原址的，什麼時候拆，不是那麼在意，轉眼間，回到這尋找圍牆遺跡，好感慨，一塊黑黑長長的牆，好厚，難以想像，旁邊留著一片空地，長滿綠油油的草，陽光普照，好似往日一溜煙，空留記憶。
0	沒什麼好逛，就一面牆
0	簡單得沒什麼意義
0	没到這裡
0	已經變成金錢化的廟宇
0	我就不相信月老希望我買他們提供的金紙、供品
0	自備的月老不收
0	神沒問題，但人有問題。已商業化，拜拜有sop，賣很多東西，還要拿卡，服務人員站旁邊三四個站好看的，完全沒有人引導流程，動線混亂，主動詢問感受到的只有態度差，添油錢也被感壓力，站在旁邊盯著看你投多少，建議來這裡的徒手拜拜就行了，金紙和香都不用買，拜個意思就好，心誠則靈，不要讓自己拜個拜還受氣～
0	第一次跟朋友去拜月老，我們倆一致覺得體驗非常差，整個商業化到不行
1	我很相信廟裡的神明會幫助自己、保佑自己，這部分必需給五星好評。
0	但這幾年每年到廟裡拜拜大約兩三次，廟方給人的感覺已經不是在服務神明及眾生，而是商業化的經營，這給人的感覺很差。以下是目前的不愉快經歷： …
0	前幾天第一次去拜月老，卻是完全不好的體驗，明明詢問工作人員如何拜月老，卻只說只要拿香或是不拿香拜一拜即可，結果聽到該工作人員與其他人講的拜月老流程完全不符（對其他人講解仔細、對我卻簡單一兩句），甚至無告知說第一次拜需要購買紅線及糖果，連首先要拜天公這事也無先說明，感覺拜的一塌糊塗。
1	一個男的，老老瘦瘦的皮膚有點黑
0	態度有夠糟糕的
0	就像是在驅趕人，12月18號下午2點20分 …
0	神明非常靈驗，但男的服務人員態度極差，東西掉在裡面一問三不知很敷衍！
0	沒照規矩買那邊的金紙
0	好像沒資格参拜一樣
0	商業化行為讓人非常反感
0	昨天是萬聖節🎃約莫下午四點接近，去拜拜，賣香的歐巴桑大姐還有櫃檯黑黑老老醜醜看起來快死掉的死人樣工作人員的，態度彷彿剛才他們家才剛死人一樣就強迫他們來工作，很不耐煩很不屑這個工作，神明服務人員那麼爛都不用品格喔⋯⋯超斂財，一直叫我投錢。我平常除了投香油錢、還有公益慈善幫助偏鄉我也樂捐、這幾年也有點平安燈。今天打電話去問陳文文負責人在不在？因為如果廟方只是斂財，並沒有真心要幫助人民，這些錢我就不願意再樂捐幫助做公益。神明是很靈驗，祈求保佑健康平安日子順遂。但廟方工作人員早期我2019年以前去拜，服務態度超熱心親切，不知道昨天怎麼遇到三個妖魔鬼怪，我還以為我走錯廟咧 …
0	來了好幾次，第一次體驗這麼糟糕⋯兩旁站了很多人，所以我往中間站，突然女性廟方人員大聲喊：小姐！拜拜沒有在站中間的啦⋯ 態度很差不耐煩又大聲？🤷‍♀️我是為了神明過來拜拜的，憑什麼讓你這樣？心情不好要不要回家去？原來你家是不能站中間 …
0	大概在一兩個星期前到廟裡詢問今年是不是有春聯可以索取，因為去年拿到老虎春聯非常可愛，想說今年也問看看索取辦法，結果被賣金紙的小姐攔下來語氣很差，好像把我當小偷一樣問我有什麼事嗎？到廟裡不是拜拜、添油香、索取春聯不然還能怎麼樣？結果他也沒辦法回答我的問題啊！
0	然後今天到廟裡去拜拜，找了另外一位有穿背心的男工作人員，我很客氣地問春聯的問題，結果他也是超級語氣差的回不知道，然後就走了 ！ …
0	捐獻是必需的嗎? 我就問
0	然後被我發現廟方人員用賊的眼神跟著我到參拜結束 ; 怕我跑掉... WC …
0	戴眼鏡捲髮男生態度超級差勁
0	在這麼神聖的地方這種態度有夠噁心
0	神明是慈悲的，只可惜這間廟宇已經太商業化了，廟方服務人員態度都比較不耐煩，尤其是那位有年紀已經是阿伯的男性，沒啥人也會趕還阻止信徒還願，說話與用詞都缺少基本禮貌，一點也不尊重人。
0	第一次去 也永遠不會再去了！！！
0	廟方人員們態度有夠差 身邊幾位朋友去參拜不了解去詢問 被推來推去 沒人想幫忙 再來買個金紙跩個二五八萬 賣金紙的人有夠厭世 問問題也愛理不理的 後來因為不清楚想確認是否能求籤 被某女廟方人員大聲說 來拜拜就拜拜  沒有在問神明的 你們有什麼事情 自己去問當事人  還要問神明（那個音量周圍民眾都聽到了） …
0	坐在城隍爺前方，廟右手邊入口處的櫃檯人員（男性）很沒禮貌，一開始詢問紅線時，他開頭就說：紅線要給250～300元才能拿。也不讓我把錢投入捐獻箱，用手擋住，示意要放在他手上，我就問！這錢是不是有被私吞的疑慮？在我拜城隍爺的過程不斷叫我，打擾我的思緒，就因為他一開始沒給我紅線跟金紙，他覺得我順序不對，也不早點說，偏偏要在我求神拜佛的過程中一直叫我。 …
0	真噁心的廟
0	問紅線多少也不講
0	也沒標價 …
0	第二次以上來參拜，為何香油錢要100元以上？是神明託夢告訴你們的嗎？還是你們廟方就此斂財呢？真正的廟宇，香是免費提供，金紙看個人是否要拿取參拜，香油錢更是隨喜！這裡廟方人員偷吃真難看！
0	態度很差，一樣是拜月老但是差別待遇，遇到的廟方人員不說清楚要先拜什麼、怎麼拜，只說前面後面旁邊，跟別人就耐心解釋怎麼拜，原本的好心情被磨到完全沒有，後來還是詢問旁邊的好心人結束最後幾個步驟！
0	廟方阿姨口氣態度即差 令人不敢恭違
0	今天第一次來拜這間有名城隍爺月老廟，但不得不說裡面一個管秩序的男的真的態度很差到不行，初次來加上現場那麼多人當然不理解接下來流程狀況，有必要這麼大聲兇狠口氣嗎？？ 但後發現他對每個人都是這樣，像每個人欠你幾百萬一樣==  好好體驗心情被這種角色搞壞
0	我說我是求紅線
0	正門的工作人員 叫我到隔壁添加香油錢之後 再過來就可以拿紅線 結果又要叫我再投一些錢 什麼套裝組合才可以有紅線 我說我只是單純想要紅線 他說沒有單純要紅線必須要買供品和其他的 然後妙方工作人員的態度讓我覺得非常的不爽感覺就好像是要推銷東西有點商業性質在的內容 月老如果被這些如果態度和講話不是很好服務人員服侍的話我想他應該會難過！  現在宮廟都已經變成商業化變得慈x一樣！
0	態度很差……跟朋友來不知道怎麼拜問了廟方人員，對方很沒耐心的隨便解釋，還講得不清不楚
0	打電話詢問櫃台請問你們祭改病符多少錢～
0	先吱吱嗚嗚然後說不知道？然後又說道士今天很忙？！
0	一個櫃檯問祭改病符多少錢然後說不知道..然後說要看你人先來每個人價錢不一樣… …
0	工作人員的臉在78💩什麼還有口氣態度再差什麼意思的
0	7月25日傍晚第一次參拜體驗很差!工作人員態度只有賣金紙那邊的一位瘦瘦阿伯面對詢問會有耐心的解釋，其他工作人員是完全不理人，會躲想問問題的人眼神
0	有一位站在面向神明右手邊胖胖的大姐，因為人多我找位置準備要拜，拜之前問了她問題，她一臉我欠她很多錢的表情說你怎麼怎麼拜就好，完全沒有解決我的問題(牽涉隱私不多說問題內容)，我真的很懷疑她剛剛有聽我說話嗎？ …
0	今天特地去月老廟想添個香油錢100元,倒兩杯月老茶(廟方準備的紙杯)放在保溫杯帶回家跟小孩一起喝，但因保溫杯裡有茶包，當下詢問在旁用垃圾袋的阿姨可以讓我把茶包丟在垃圾袋嗎？沒想到阿姨直接開罵一直碎碎念後來廟方一位阿伯也加入碎念的行列，左右開念的說不能用保溫瓶裝，不然其他人會有樣學樣 我告知只要拿兩杯而已，我會裝在保溫瓶裡，這樣也不行，兩人一邊碎念一邊離開，尤其是那阿伯還用不屑的眼看了我一眼，讓我覺得有必要這樣嗎？態度囂張惡劣，以後不會再去了,又沒有多靈驗。
0	錢錢錢。不說我還以為來到財神殿了
0	師姊態度真差勁👎拜月老牽紅線還要收水費
0	服務台那個老人態度差到極點
0	當初求紅線的時候正好遇上人潮多，廟方很商業式的帶大家走流程，在拜月老時根本還來不及許完願就被趕走，“來！去拜下一個，下一批進來！”令人感覺很差
0	（一顆星是給當天帶我們拜的廟方人員，
0	莫名花了3000安太歲!大失血，貴又很不靈驗TT
0	...... 應不應驗應該是看運氣吧!跟誠心無關
0	服務人員態度很不好
1	講話又很快 …
0	別人進來是問要不要買金紙250
0	我要問就收起來，要買供品跟金紙才會理你
0	態度不敢恭維
1	霞海城隍廟，求姻緣很出名
0	求一個紅線 要付300元
0	再加上買金紙要 100元 …
0	非常惡劣！！！
0	9月份上網查詢，該宮廟為信眾祭解費用為300元後再去電確認，道士親口告知費用為300元，若另做較完整的祭運只要再加1200元⋯兩次確認後決定於9/28專程北上跑一趟。 …
0	有個胖胖的男工作人員很奇怪。我陪朋友去拜，因為沒拿到紅線，就請教他，然後他給了紅線後跟著我們走出來，一路碎碎念「有拜沒拜有差嗎」，還講了兩次！然後我跟朋友拜完後站在馬路邊聊天，他又直直朝我們走過來，我們覺得很奇怪就走掉，然後他居然對著我們碎碎念說「這樣真的不行」！奇怪到底是哪裡惹到他？而且在廟宇工作還說有拜沒拜有差嗎？不想做這份工作就滾啊！不要把自己生活的不如意發洩在香客身上！
0	晚上六點半左右陪朋友去求姻緣，添油香的櫃檯是三個年輕人顧的，態度還可以！但花300塊領供品的櫃檯就很差勁，甚至兩三個人在寺廟裡抽煙聊天，花了300元更被草草了事，整個講解過程大概30秒結束，總之過程極為糟糕，若這是國家級的寺廟真的蠻丟臉的⋯比較像巷口的土地公廟！
0	室內防疫不足，是個防疫破口，主殿前看到兩個師傅（未戴口罩！）不間斷幫人唸經，而且還繞行整個廟內區域
0	櫃台阿姨很勢力眼，求個發財金還在上下打量，以為騙錢的嗎？騙的過神明嗎？捐米的時候又一種嘴臉，到底是不是在替神明做事情，當然廟裡一些阿伯阿姨還是很熱心很有人情味，希望廟方別讓一些老鼠屎壞了廟方的聲譽。
0	今天要去拜拜時間是19：35左右，廟方人員就急著把門關上,也不會體諒寬容幾個專程要到這邊拜拜的人，差個幾分就關門，是想急著下班嗎，態度惡劣，這不是寺廟嗎，竟然會有這種廟公
0	廟務人員態度很糟，很糟，很糟糕！神明被這樣的人服侍著好可憐。
0	賣香火錢的阿公阿嬤少找我200塊
0	打電話過去問 廟方人員還說 那你打過來幹嘛
0	網路上又沒有香火錢那裡的電話
0	態度真的很不好
0	一星是給廟方人員的，態度真的非常差，去過許多寺廟沒有一間寺廟人員是這樣的，問問題態度不耐煩成這樣，建議大家先找好SOP，千萬別跟人員講話，不然你會一肚子氣。
0	陪朋友拜，感覺太商業化，廟方人員態度又差傲慢，我沒買拜月老供品，第一次拜不懂參拜順序問了一下廟方人員如何拜，廟方人員愛理不理的。
0	廟方香火鼎盛 但流程不清楚 ，跟兒子去拜月老要問廟方人員，結果在神壇前教人家拜拜的年輕人，態度超差的，瞪大眼睛像是欠他錢似的，這樣的服務態度，我覺得沒有資格在那裡服務。
0	神明很靈驗但服務人員態度很差…稟報完城隍爺後要化疏文…不給化…而且態度不好
0	廟方人員態度惡劣，會亂推人。
0	極度商業化的一間廟，沒消費，廟方人員就會愛理不理。
0	來拜拜還要看廟方人員臉色，口氣態度超級差的，真的以後不會再來了，一肚子火。
0	對城隍廟沒意見，但裡面的道士部（委外），祭改要1200元，外面頂多400~600元，且還說要不要看你，傲慢至極。
0	工作人員說直接拜沒用，要到櫃檯付250-350買他們的套裝才有用，商業化嚴重
0	那位櫃檯收香油錢給紅線的女子，態度非常差，差到爆，從10年前我還是學生到現在上班，她就那種傲慢態度，懷疑這種人為啥可以服務大眾
0	只要沒買供品，廟裡人態度很不好👎供品又貴 …
0	今（2017/1/1）下午協助倒（？）平安茶的工作人員（志工？）脾氣很差，話不能好好說，只會大吼大叫，我們可以自己拿紙杯自己倒啊！
0	線上籤詩覺不出感應，顯得跟風兒戲，把信仰給娛樂化了！
1	很多人去拜
0	但廟裡面的服務人員態度可以好點嗎？
0	態度超差
0	有個男工作人員態度差到爆炸，他自己覺得大家都懂他在講什麼，在問一次，就在那邊不耐煩，祝他一輩子單身。
0	我求了6年，連個影子都沒有，這間月老只幫名人和外國人牽紅線打知名度，我們普通人不被放在眼裏
0	整個不知道廟方人員在不耐煩什麼，你們要在廟裡服務這種態度可以嗎？
0	一進來就要我戴口罩，我戴了，但是旁邊的工作人員自己也沒有戴
0	有點討錢要的感覺
0	很不愉快的經驗
0	完全沒有廟宇的感覺
0	就是要錢.................
0	城隍爺辛苦了，沒想到工作人員居然說金紙都是拿到焚化爐燒，聽到令人難過
0	非常商業化不說，裡面的人態度也極差。還在燒香有夠不環保
0	非常不尊重鄰居安寧的廟宇，不是神的問題，是管廟的人的問題!
0	五星是業配給的吧！態度非常差勁，只有爛一個字
0	非常商業化 讓人不舒服
1	神是為了保佑平安，人是為了廟而賺錢
1	其實指導員不需要那麼跩，世界更美好喔😊 …
0	廟方全部人員心情可能不好，臉色菜菜
0	阿伯超兇！突然被嚇到都忘記跟神明講什麼了...
0	不靈
0	服務台的阿伯態度不知道在不耐煩什麼……
0	非常不準，不懂到底是在有名什麼的
1	變得很商業化
0	不靈驗
0	沒什麼印象 不推
0	沒用
1	人多
0	不靈
1	周邊有美食
0	不予置評
0	對遊客非常粗魯。我坐在一張沒人用的塑料椅子上。照片上的女人和另一個正在翻譯的女人告訴我，我不能使用這把椅子，因為我不是顧客。我認為這是一個宗教場所，而不是商業場所。我必須買東西才能使用椅子嗎？他們甚至建議我到寺廟外面去。我不明白這怎麼可能。我希望這個寺廟有更好的員工！
0	工作人員不友好。
1	公車 …
0	網路看看就可以了，不要去了，一張門票380元逛10分鐘就看完了，沒有導覽員，也沒有印ㄧ張DM，也看不到相關的儲水蓄水設備，跟網路的相片天差地遠，裡面烏漆嘛黑的，跟網路明亮的照片對比真是大失所望，一堆風馬牛不相及的裝置藝術，跟這自來水博物館有啥關聯？ …
1	觀音山蓄水池在思源街1號，要從公館捷運4號出口-＞往公館假日市集方向走，到自來水博物館喔！
1	天然蕾絲採集處
0	已開放排隊進入參觀 每天10:30,14:30排隊領票，只20名。但機制很差，牌子都立在那裡，根本不到14:00就已經額滿，很好奇那官方說法的時間是參考嗎？ 哼
0	沒有任何標示照著地圖走根本找不到 很可惡害我白跑一趟
0	方向圖是錯誤的，它不是每天都開放......花了一個小時試圖找到它並且它關閉了......只在周六和周日開放......如果我能得到它可能會標記更多在那裡
0	112/7/1打電話詢問問題都說可以使用
0	112/7/7到現場。卻說不行⋯整個傻眼🙄️
0	112/7/7買完票後再打電話詢問 …
0	這裡的掃地人員真的很沒禮貌 坐著沒用到他叫我們閃開😠😠🙄 …
0	驗票小姊姊，重複進入閘門沒有開好，導致被門撞到
0	然後一句關心都沒有，另外一個服務人員也是在笑而已
