label	text
1	大約廿年前就開始常來這裡散散心看日落，當年堤岸邊的建築還是嶄新的，裡面還有賣吃的和一些蛤蜊漬物，房子上方還有「活力海岸」四個字，時光無情有的讓人、事、物變得更好，有的隨著落日不再東昇，最近看著漁港週邊的荒蕪，和斑駁欲墜的堤防水泥塊，大理石刻的「活力海岸」四個字卻鮮明依舊，給了台西港衰頹最大的諷刺。
1	"第2張照片遠眺的盡頭就是六輕，除此以外，這裏的養殖業規模不小，一方一格都是心血！,谷歌地圖臺灣箏美臺西漁港！"
1	西濱線上的小漁港，膠筏漁船.串串白牡蠣殼，一般的遊客不會來此處，愛寧靜.獨特海洋風者，卻四處遊走.賞海景.看日落。
1	台西漁港在退潮與進潮時船無法進出，蚵農船隻特別注意，退潮後濕地有很多，彈塗魚，螃蟹，蛤等可有忙碌了，是魚農可得額外收入。
1	風景很棒。
1	遠離塵囂的好地方。
1	讚ㄛ！
0	沒什麼特別也沒有東西可以買 風景普通
0	堆滿蚵殼，顯得髒亂
1	觀賞夕陽絕佳地點！
1	釣魚的好地方
1	"2023,6,22（星期四）下午2點30分，端午連假的第一天，早上要拜拜，中午就出門逛逛，天氣好炎熱。,好清靜，感覺好莊嚴，可能太熱沒什麼人，旁邊有個小魚池，裡面好多烏龜，化妝室前有顆樹，遠看以為是釋迦，近看才發覺不是，也不知是什東東。,停車方便，寺廟的後面有顆光蠟樹，樹上好幾隻獨角仙，順便拍照一下。"
1	社頭清水岩寺起建立於清朝雍正六年，公元一七二八年，曾在乾隆初年改建，至嘉慶四年才移至現在這個位置，與虎山岩、碧山岩合稱中部三大名岩，而清水岩寺又因地出泉水、風光明媚而有「清水春光」的美名，更是彰邑八景之一。清水岩寺是全台灣主祀觀音而屬於超鄉鎮性的6座區域廟「巖仔」之一，以前的祭祀範圍在武東、武西堡共72庄，範圍涵蓋社頭鄉、員林鎮、永靖鄉、田尾鄉、埔心鄉，與枋橋頭天門宮同，現在由鄰近的山湖村、清水村與埤斗村共祀。 …
1	"身心靈感受很舒服的古寺,一旁還有公園及步道...,好吃的芭樂及便宜純棉的襪子手作醬油...收穫滿滿 …"
1	平日帶家人出遊，特到此地一遊，廟前有一處停車場，廟裡有百年甘露水泉池，水質乾淨，且附近有多條步道可健行，拜拜完可順道去走走
1	要八柱香，拜完怎多兩柱香，遍尋不著爐，後來才知道，門口有兩個鯉魚香爐拜門神用，還真沒遇過，很有歷史和特色的觀音廟寺。
1	免費森林健走體驗區。是三級古蹟以清水岩為車停區。跟觀音佛祖問訊後可規劃走三小時或是一小時的18灣。適合全家人大小一起玩的有昆蟲生態館等。
1	古樸清淨的寺院，在這邊感覺很好，可惜蚊子太多，轉經輪附近的空地不曉得在曬什麼，引來很多蒼蠅有點可怕
1	人不多 閩式建築古蹟
1	三級古蹟寺廟，主殿供奉觀音佛祖。環境清幽，寺廟前庭可停車但車位不多，周圍有幾個攤位可解饞；旁邊有個蝴蝶科學館，後面有步道可走，步道低平很好走，是個適合親子或帶長輩走走的好地方。
1	廟有獨特山泉水跟喂魚生態池滿平靜的好地方 裏面有位子坐想唸經也很適合 向佛菩薩祈福參拜掃除心靈塵埃
1	附近有免費的停車場可供停車，還蠻大的不怕沒車位。寺旁有生態館，裡面有各種昆蟲的標本，有台灣本島的及國外的蝴蝶，天牛，獨角仙，鍬形蟲...，很適合帶著小朋友來認識昆蟲，館外有兩隻巨大甲蟲可供拍照，而沿著旁邊的走道下去，及可通往清水岩寺，寺廟很是清幽，寺前的松樹似乎是伴著寺走到現在，非常高大且屹立不搖，再由寺旁的小路走上後方的山坡，有好幾隻蝴蝶翩翩飛舞，剛剛才看過的標本記憶猶新，可以馬上現學現賣，就是在這個雨後的山上有好多的飛蟲在我身旁圍繞著，是唯一我不用看標本就叫的出名字的，記 …
1	第一次專程來探步道。好多停車場地:hundred_points:，端午雨后沒蚊子，剛好也是獨角仙孵化季節。爬上山頂是一片視野清新的茶園。 …
1	"百年歷史的古廟，進來參拜一下，總能感受內心片刻的寧靜…,喝喝一旁的甘露名泉，頓覺神清氣爽，煩惱飛逝而去…."
1	園區的花開的特別美，環境特別清靜，值得過來參訪。附近還有新開發的溫泉露營渡假村...等景點。
1	停車方便，環境整潔，但登山路徑的指標不太明確，我一度誤闖廟後的私人土地，可由此往橫山步道（登山步道皆在廟左方）
1	陪老人家來懷舊走走，老人家上一次來是大約五十年前的事了，我第一次來感覺很新鮮，可能是過年期間，攤販有點多，另外搭了棚子遮住了原本莊嚴的廟宇全景，稍微有點可惜，不遠處就有免費停車場，車輛流動蠻快的，所以停車算方便，希望下次有機會再來造訪。
1	"彰化社頭-清水岩寺,,社頭知名景點，也是全台知名廟宇，每到端午節，更是排著滿滿的人龍來取午時水，這座甘露泉，列為台灣三大名泉之一，可是聽說連蜜蜂都愛喝呢～ …"
1	百年歷史的寺廟，台灣本島少見的有大象的擺設，後面有步道可以散散步，因為在地都種芭樂居多，所以沿路有很多的攤商販賣
1	"無障礙空間做得很好，,古蹟很美 …"
1	佛寺風景好，服務不錯，廟邊有六字真言轉輪，108大顆的佛珠可以拉唸佛號，公園優美，有甘露泉可浴佛，清水岩佛祖菩薩很靈感有空可以去看看
0	清水岩寺是我一直想來拜訪的寺廟，座落在山邊的古老寺廟感覺很有靈氣，3/1終於到訪，看見的卻是廟前放著熱鬧有餘、莊嚴不足的紙版及大型觀音裝置藝術，粗糙的大型觀音完全擋住了寺廟的正面，不知道這些裝置是暫時還是永久的，只希望能趕快移除，還給清水岩寺原本清淨莊嚴的面目。廣場週邊的攤販也沒有好好規劃，看起來很凌亂，參考日本的神社做法，寺廟的神聖性和商業性是可以取得完美平衡的。
1	"供俸在山區的寺廟，主祀觀世音菩薩,又帶有點道教風味的佛教廟宇，寺廟外有可供打卡拍照的景點佈置，也有象徵招財的許願池，廟外廣場常有產地特色的攤販，是南投當地著名的景點廟宇"
1	"每次來到清水岩寺就覺得心曠神怡。,池塘的小烏龜們超可愛，每次都會駐足觀賞，涼亭旁的健康步道總愛脫鞋挑戰一下。,一進到廁所眼睛為之一亮，新穎漂亮，除了廁所地板有些潮濕外。"
1	"本寺廟是由兩村住民合力建造的，因此入廟門窗左右兩邊龍的數量不同(找找看有幾條龍)，綴飾、樑柱獅子也不相同，係源自兩村為體顯自家師父功夫暗自較勁所呈現。,主神供俸第壹代觀音大士(男)，不同於其它世代轉世觀音為女性，寺中更有特別的往世籤，可供信徒問前世的問題。,廟宇中還有奠基石，為磁場最強的地方及建廟中心點。若有弟子發願或懺悔等問題，可站立於此向大士祈願或反省懺悔罪過。 …"
1	"傳統信仰中心，旁邊還有展館（免費參觀供水及廁所,步道也非常值得一走，推薦來玩一下午"
1	三級古蹟清水岩寺，具歷史感，古樸莊嚴，停車方便，旁邊有生態中心，展示蝴蝶.甲蟲標本。每年五.六月也是獨角仙活動時期，值得觀賞。附近又有十八彎古道，可以健行休閒，親子旅遊的好去處呦！
1	清水岩寺有幾個特殊的地方，第一是山門口有幾隻踩著蓮花的石象，第二是這裡種植著不少山茶花，聽說有一株樹齡已有二百年了，第三寺內有一個大型硨磲，第四據說這裡的註生娘娘是全台灣最古老的軟骨金身，第五這裡有一股天然湧泉~甘露泉，第六寺內正殿懸有「慈雲廣被」、「南海慈航」兩塊乾隆、道光年間古匾，第七這裡有座清水岩生態展示中心，展覽很多難得一見的昆蟲標本。 …
1	"已有277年的歷史的古寺，,更是彰邑八景之一的""清水春光""。,古寺內更有甘露泉水，清涼消暑。 …"
1	來社頭定要來的景點，非常具特色的古蹟廟宇，屬閩式建築，廟宇的彩繪、廟宇的燕尾脊，以及壁上立體浮雕，還有周圍生態環境，很值得一遊的在地廟宇，感恩神佛菩薩保佑眾生平安！
1	建在風光明媚的八卦山上，清朝時就是彰化八景之一了，目前整合了周遭的自然生態，成為人文又踏青的好去處。一旁的庭園優美，有不停湧出的甘露泉，洗淨身心。
1	"很美的古蹟，拜拜內心感覺很peace,附近還有步道可順道走走,位社頭鄉，再帶走好吃的芭樂"
1	生態非常豐富，蚊蟲蜂蟻甚多，到此探訪登山建議穿長袖長褲。
1	社頭郊山的佛寺，清幽乾淨，寺方用心維護，可求得心靈平靜的宗教地。可順道走清水長青自行車道或一至五峰，身心靈都健康。
1	百年古剎寧靜致遠，可以靜坐、可以賞蝶、可以健身，適合獨遊淨心，適合全家共遊 ，也能慢遊學手作！
1	清水岩寺，從社頭街區往上走，很快就到了，一路緩坡，小鎮鄉村農園河堤之美盡收眼底。寺廟本身幽靜，群樹環抱，香煙袅袅令人肅然清心，若能沉潛聆聽山音，可掃淨塵俗污氣。清水岩寺也設有小小公園，可以清泉澆手輕拂感受神明聖恩，寺廟並結合生態保育，有園區也有解說館，是認識各種甲蟲（尤其是獨角仙）的絕佳休閒去處～ :smiling_face_with_smiling_eyes:【照片１：古色古香的純樸廟宇小巧親切幽清】【照片２：秋末初冬花開時節一片白雪木盛開如雪紛飛極美】【照片３：廟後方生態園區設計頗用心來訪總有驚喜收穫】 …
1	"多條登山步道可以健行，旁邊的昆蟲館 有許多的昆蟲標本可以參觀，有附導覽 手冊，附近的清水岩露營區有溫泉泡腳池， 爬山完後可以去那邊泡腳舒緩 、輕鬆一下, 是一個可以兼顧登山運動，帶親子活動的好地方， 重點是都不用花門票費喔！"
1	"2021年3月16日星期二的上午九時10分，天氣晴朗，氣溫20度，實際體感溫度19度，我在彰化縣社頭鄉的“清水寺”內慶菜走走。,,清水岩寺,511彰化縣社頭鄉清水岩路1號"
1	"第一次來這裡，真的是不枉費此行。,特地過來感受，很棒的規劃。附近的登山步道也是很多人  很清幽的環境。"
1	"有時間可以來走走,順道去走18彎古道"
1	"社頭鄉清水岩 有股清新的氣場 靜.......,讓人不由自主的坐下來 坐下來，在進入口處 有口滔滔不絕的自然井 井水清涼甘甜 是在地人的最高福報.仰望天空 在廟宇裡 觀自在 處在當下的淡定...."
1	是一離市區不遠的寺廟，空氣好，停車又方便，旁有生態環境館，前有登山客咖啡店，登山、健行、沈澱心情皆宜！
1	風景秀麗適合全家出遊走走的好去處，旁邊有免費停車場，停車場旁有昆蟲標本館，適合親子同遊
1	百年古蹟，小小的廟宇，能感受歷史的氣息。廟前有二顆老樹，旁邊還有生態館可參觀。
1	很有歷史的廟宇，且外面還有甘露泉水見證這段時光，在附近步道運動的人，可以經過時來參拜一下。
1	"這座廟是我自己覺得有神在的廟宇，其他的廟宇沒感覺到。,四年前，參加-彰化一日遊-來到這間廟參觀，一踏進廟的中庭，馬上一種心曠神怡，難以言喻的舒爽感迎面襲來，馬上就留下深刻印象。回去後，跟同事聊到孩子問題，她一直懷不上孩子，我建議她要來這裡讓娘娘摸一下肚子，後來有了，目前已經生了第二胎了。,我下個月還會再來此廟拜拜，求神佛保祐我闔家平安。"
1	清水巖寺隔壁的昆蟲生態展覽 種類繁多非常棒。而清水岩寺旁邊的庭園 適合 散步體會 古寺的寧靜。 旁邊在地農夫 的芭樂 好吃又便宜 賣相不好看應該沒有使用農藥推薦。
1	具古蹟觀光與歷史文化、教育、休閒、保育、活動中心，更是全台最佳的心靈休息站。
1	從田中自行車道健行到這裏，環境清爽宜人，林蔭步道，免烈日曝曬，寺中服務人員親切和善，有鄉間人士質樸敦厚的性情，在古蹟映照下，讓人留連忘返。
1	"百年的廟宇 環境很好,又有步道 有獨角仙館哦,會辦活動 小孩玩的很開心"
1	造型簡潔素樸飛簷翹脊倚山而築～主奉祀三寶佛、觀世音、地藏王菩薩。另旁邊有昆蟲館，適合全家老少青踏青，育教娛樂。
1	"常常辦活動，費用非常的平易近人,有DIY、美食、登山 …"
1	小型的廟宇，主要供奉觀世音菩蕯、地藏菩蕯、清水祖師、註生娘娘。有自己的後花園，隔壁就是昆蟲生態展示館。附近很多停車位，容易停車，參拜完還可去爬十八彎古道。
1	相當有歷史的廟寺！總能讓人心平靜，求神拜佛，祈福平安，很值得來一趟。
1	2022.10.09 非常有歷史的古廟。環境清幽人潮不擁擠一。廟前有停車場
1	假日可以來走走的一座寺廟，環境清幽，導覽解說相當不錯。
1	當地登山健行 回程的最好休息地方 很多當地水果 社頭芭樂…… 有昆蟲展覽館
1	很棒的地方， 寺好風景美， 停車方便
1	"過年期間很熱鬧，寺廟外面有許多攤販,停車場停車方便"
1	人不多，寧靜的寺廟古蹟，旁邊有昆蟲標本館可以參觀， 後山有步道可以健行
0	105年6月25日來到這邊，有部分的步道好像正在整修維護中，所以沒有全部都看完。 要回家的時候看到有些人，拿著罐子在抓獨角仙覺得很不OK。
1	是個有用心經營的寺廟，1725年就有了
1	人潮不多，很清幽。來這邊爬山不用人擠人很不錯。
1	參拜後 心情平靜   外面還有阿伯賣芭樂跟番茄 可以多多幫忙！ 跟他購買芭樂都多送給我們。
1	櫻花開了很漂亮， 附近有很多登山步道可以爬！
1	"一個古蹟寺廟 保存的相當完整，地靈人傑,夕陽相當漂亮"
1	可以來這拜拜，走走逛逛，有清水岩生態展示中心參觀，還有社頭芭樂可購買。
1	水喔！社頭芭樂好吃:face_savoring_food:
1	古蹟寺廟，爬山會經過景點！
1	今天首次參拜，廟後方有停車場，周圍停車方便。
1	莊嚴寺廟，旁有昆蟲館，周圍幽靜、生態豐富。
1	走完步道後適合休息的好地方，隔壁有生態展示中心可供參觀！
1	環境清幽，蝴蝶飛舞，隨處可見獨角仙，而且植物種類很豐富。
1	一個很放鬆的地方
1	清水岩文創協會時常舉辦體驗營、生態導覽、還有豐富的DIY手作課程，非常適合親子一同參加喔。
1	不錯的觀光景點 有舒服停車場 是課外教學認識植物 昆蟲的好地點
1	"散步好地方,能看到少見的蜜蜂喝水,水質甘甜"
1	清水岩寺歷史悠久 甘露泉水真的很好喝
1	環境很大。寺廟很靈。古色古香
1	寧靜禮佛的好地方
1	傍晚來散步、運動，磁場不錯、但就是夏天蚊子有點多、要穿薄長袖比較適合。
1	"寺廟莊嚴環境清幽,主祀觀世音菩蕯"
1	人潮不多，適合想安靜放鬆健走的好地方！
1	寺後的步道可走走，給大自然抱一下
1	"寺廟導覽解說很精采，讓人滿載而歸!!,午餐吃素食滿滿新鮮蔬食，不是加工食品，真的很棒!!"
1	3級古蹟，總幹事導覽超棒
1	古樸典雅的建築，清淨祥和的靈氣
1	廁所維護的算乾淨
1	環境清幽的百年古廟值得一看，廟旁有一個台灣三大名泉之一的”甘露泉“，喝上一口真的是清涼爽口，後面的奇花異草也很不錯，出去走走看看吧！
0	後山的橫山7100步道，空氣清晰，健行活動的最佳地點，唯一缺乏洗手間，對女性朋友一大不便
1	"不要在假日, 人少時多了一份寧靜"
1	第二次來，有很多茶花可以欣賞
1	很清幽的環境， 旅行途中到這邊放空一下， 就能繼續前進了
1	踏青的好地方，旁邊昆蟲館，可稍稍停留
1	美麗清幽的寺廟，附近還有步道可散步運動！
1	"梨山地區的發展很大貢獻,恭喜山谷燈光節-璀璨梨山榮獲美國繆思大獎柏金獎"
1	"很適合親子同樂的地方 不過有些地方有點抖,爬山時 還是要注意:warning:一下,生活分享:smiling_face_with_smiling_eyes:蠻不錯的登山步道 …"
0	南庒花卉節那個告示牌的停車場方向根本亂搞，車子照指示開進去英姐小吃店旁，指示牌停車場寫向右，請問是要爬上去吊橋嗎！
1	叁山風景區的管理處位在台中霧峰區，轄三個山的風景點，共有六個遊客中心提供旅遊資訊
1	很棒的好地方，盡心盡責為推廣觀光而努力的單位！
1	八卦山遊客中心旁的圓形廣場 已經一個多禮拜到處都是石頭 泥沙，沒人清理。接著又要辦活動 讓人觀感很差
1	我們去年去處本部清潔打掃覺得很輕爽處長人很好副處長人很好
0	辦活動亂封路，胡鬧！
1	是一處休憩放下喧擾的好地方。
1	林班道體驗工廠為延續振昌木業的精神理念，打造的DIY木作工藝園區，體驗工廠擁有近百種木作品，提供已裁切好的木材及DIY組合教學，讓遊客在自已動手做的過程中，感受DIY的樂趣以及完成的成就感，結合傳統手工技術及休閒娛樂的好去處，帶有巧思的各種生活用品加上獨特的手工藝，讓每件作品都是獨一無二的。
1	"小時候來車埕都很想要體驗看看做木椅子、但每次都錯過！這次來訪，看到比以前更多的傢俱選擇～小型傢俱落在300-600之間；中型傢俱則落在600-1200之間，加上體驗製作的快樂，其實不會很貴！（但想想ikea的組裝傢俱好像也是這樣哈哈哈）,個人蠻推薦小朋友來嘗試的，這些組裝容易可是卻能讓人很有成就感！同時這裡的傢俱材質不錯，不是易碎的壓合板。如果覺得孩子需要地方消耗時間，那就來做一張椅子吧！"
1	車埕火車站旁邊，有林班道手工木製工廠，可讓小朋友DIY做桌椅等，好玩有趣，累了就走到鐵軌拍拍照曬曬太陽，還有風景優美的用餐環境，包您滿載而歸。
1	有DIY課程，店內很多木製商品，雖然店面不大但商品還蠻多的，還有一些益智遊戲可以玩，可以來逛逛，順便看看有沒有喜歡的木製商品～
1	沿著貯木池的步道一路逛去車埕老街，再往車埕火車站看歷史建築物，再去林班道體驗工廠看DIY的手做木工工藝品，整個逛一圈充分體會車埕這地方的文化資產。
1	"林班道體驗工廠,,這邊很多木製產品 …"
1	想自己DIY木頭家具，架子，木質品，一定要來車埕林班道自作工廠，製作的東西選項很多，材質很好，都很實用，價錢不貴，服務員細心教學，是個很好的體驗。
1	已經是最後一位客人，老師還是很溫柔細心講解，可以組裝DIY也可以另外買顏料上色，真的超級棒:smiling_face_with_hearts: …
1	林班道木作體驗課程一看就覺得滿有趣的，可惜太早到了尚未開始，如果有帶小孩一起前往相信可以為旅程增添許多回憶～ 也有完整的成品可以購買呦！
1	免門票，內部空間不大，主要提供木作DIY童玩、傢俱及各式手工藝品，可購買成品也可自己組合，木工DIY只收取材料費，依品項有不同價格。20人以下不需要預約，營業時間內隨時可體驗。
0	"DIY的部分頗失望,都是非常簡易的組裝商品,沒有什麼木工技巧 …"
1	可以自己手作DIY木製品，還可以烙印，會讓我給到5顆滿星是因為吉祥物:monkey:超級可愛:smiling_face_with_hearts: …
1	這裡的木製品給人高品質的感受，價位也合理，另外可以讓人現場體驗木工，是非常有特色的地方。
1	賣的木製工藝品很多，我們用完餐後就來烙印圖案，整體來說非常大
1	以前就來做過椅子了 東西耐用味道香 是實木頭製的 很推薦一家大小來玩 :grinning_face::grinning_face::grinning_face: …
1	很棒的體驗場所，有很多可以參觀唷，也有紀念品。
1	"公司自強活動來玩的,,今天是玩做女兒椅活動，敲級簡單 …"
1	木製DIY選項不少，價格稍貴些但尚能接受，可免費參觀
1	環境：有商店跟DIY木工區，商店內有不少好東西，可惜都不能拍照，沒辦法幫店家做宣傳~
1	南投車埕林班道DIY木工製作，現場老師很親切會全程陪你製作的過程，購買材料的費用即可 ，不會再收取其他的費用。
0	很有趣的地方，沒有說非常大，但內容豐富，景點內也很多可以逛的地方，唯獨進去的路小了點，停車不是很方便就是了。
1	新鮮有趣！老師也很有耐心的帶領我們組裝椅子，產品品質好又便宜，希望能有網購平台！
1	"除可實作也有導覽介紹,相關保存設備頗富古味"
1	吃完便當來幫蓋子烙印的地方，有DIY教室和木製品（紅酒架、手機架、名片盒等等）
1	"服務親切,適合帶孩子體驗木工DIY的好去處!"
1	換地點後感覺很不錯，除了diy之外，還有展示館可看
1	很好玩而且還可以做天車椅
1	木工體驗DIY，走走逛逛挺不錯的
1	有很多小家具、用品和玩具可以選擇來做DIY（現場或帶回家皆可），體驗工廠空間大，難度剛好，不管是大人做或是小朋友做都很適合！旁邊老師都會親切的教學，非常推薦！！
1	感覺蠻不錯的，我覺得比阿里山好。
1	這是個可以給大小朋友一起DIY木作的好地方
1	體驗工廠的老師都很親切的指導孩子們靠自己完成作品！做完DIY後附近就有好吃的餐廳一邊觀賞美景一邊用餐⋯餐後還可以帶回木桶，劃下完美的句點。
1	可以參觀、DIY蓋印、有木材制品可買，很讚
1	"木工diy組合體驗 價格便宜 還有烙印木盆服務,服務人員親切專業"
1	環境優美 古街好 適合帶親子遊玩的地方
1	可以DIY也有許多東西可以採買
1	相當漂亮的空間，還有木作介紹及展示。
1	DIY實作工藝，也適合親子互動的體驗工廠...
1	很酷！有很多木造設計的創意產品，還可以參與手作。
1	很精緻的木製品，旁還有DIY體驗
1	DIY體驗椅子烙印好玩
1	秋冬來，微微的涼意，假日休閒好地方，抓寶的好聖地
1	商品價格不高，又可以在現場體驗木頭小家具DIY的樂趣，老師也很細心親切.
1	"育教於樂的地方,體驗木造小物很特別"
1	小孩一起現場DIY很不錯，又可以做紀念
1	"木頭很香,椅子很棒"
1	很適合帶小朋友出遊的地方，可以了解到好台灣早期林業發展的故事，也能體驗木工DIY，是個寓教於樂的好地方
1	帶3Y7M的小孩來體驗彩繪DIY，小孩有穿圍兜不怕弄髒衣服，老師們熱心親切又幽默，整個過程開心歡樂，推薦大家可以一起到這邊來彩繪～
1	"DIY木作工藝園區,木製DIY選項的選項蠻多,遊客可以選擇自己想要組裝的木製品 …"
1	木作DIY的地方。可以買一些他製作好的材料自己DIY組裝。有有提供座位工人休息。以及賣好的一些手作品紀念品
1	"車程林班道為早期的振昌木業，專門提煉檜木精油～,現轉型為觀光工廠，提供多樣DIY給遊客體驗！"
0	我個人覺得自己也沒看清楚商品部分（整個包裝起來根本無法開來用），他火車與托車品質真的很差，買了又無法退，只能換商品，但對這品質不敢恭維⋯購買請注意⋯
1	很適合拍照的地方～全木製的廁所 還有各式各樣火車跟慕谷展示館 ，適合全家大小假日的好去處
0	路線安排無規劃，園區那麼大完全一直再繞圈圈，通道也亂七八糟，店家也沒什麼，強烈建議帶老人及不喜歡走路沒東西看的人去
1	"Diy天梯椅,質感還不錯"
1	林班道的DIY工廠換位置了，害我沒有做到天車椅，只有做到車程木業館的冒牌貨。
1	風景好空氣佳散步散心的好地方，可觀賞木工作品，帶小孩做木工體驗，逛車程車站及老街，非假日人潮少若運氣好有免費停車場可停車
1	可以待上一整天的地方，玩手作吃飯喝下午茶都可以很好解決，唯一感覺好像人潮變少很多，所以附近老街都沒有什麼營業，推薦全家可以來玩。
1	當天去製作天梯椅的DIY，服務人員親切，製作過程教的很詳細，DIY很有趣
1	很適合全家一起出遊的地方，可以逛、也可以休息、也有體驗木作的教學，還有這邊的一些歷史導覽，很棒的地方。
1	來很多次囉.
1	DIY課程蠻好玩的
1	很舒服愜意的車程
1	可以體驗DIY!超好玩有超好拍的地方。旁邊有店家賣在地手沖咖啡。值得一試
1	只能買現場的材料包在現場進行組裝、塗裝喔！
1	可以作木椅和木作喔！有專業老師在旁指導，讓你順利完成喔！
1	很好的體驗場所，適合小朋友
1	適合親子共遊的地方
